{
  "contract_version": "3.0.0",
  "workflow_mode": "reference_guided_enhancement",
  "project_id": "bonds-immersive-v3",
  "narrative_hash": "sha256:3afff721bf1739a36bfa3130f929f845931e32d8a92fd5cf3e932a0d41c3ceb2",
  "status": "approved",
  "direction_id": "bonds-v3-guided-continuum",
  "direction_options": [],
  "user_approval": {
    "status": "approved",
    "checkpoint_id": "bonds-v3-enhancement-mandate",
    "reviewer": "Alvaro Chacarra",
    "reviewed_at": "2026-08-25T21:00:00+02:00",
    "approval_reference": "projects/bonds/approvals/enhancement-mandate.md#user-mandate-2026-08-25-v3-immersive-slide-enhancement",
    "approval_scope": "Implement and comparatively audit controlled enhancement of Bonds Slides 2 and 4; final enhanced remains subject to user perceptual review.",
    "changes_resolved": true
  },
  "reference_bundle": {
    "source_branch": "image-to-code",
    "source_commit": "a855e8465f609bf99bc6f8066fa60b7a89fd6346",
    "design": {
      "path": "design/DESIGN.md",
      "content_hash": "sha256:72ec9a55b8c60ec55ad9b2391c64dd9926ec30074abf7bd8a23636ee17c28743"
    },
    "project": {
      "path": "projects/bonds/PROJECT.md",
      "content_hash": "sha256:3afff721bf1739a36bfa3130f929f845931e32d8a92fd5cf3e932a0d41c3ceb2"
    },
    "authority_resolution": {
      "semantic_authority": "semantic_spec",
      "perceptual_authority": "reference_guided_enhancement",
      "conflict_policy": "block_upstream"
    },
    "units": [
      {
        "unit_id": "slide-02",
        "semantic_spec": {
          "path": "projects/bonds/slides/02-bond-anatomy.md",
          "content_hash": "sha256:30e7e4e85bbb5f029c4f1d866de3fdf07461b2b416a40357173be08ed91fafb4"
        },
        "reference_id": "reference-02",
        "reference": {
          "path": "projects/bonds/references/02-bond-anatomy.webp",
          "content_hash": "sha256:1842c1e2ea5d005a177622f77f1efa57c24198344a3eabf60f1e46d21d52f50f"
        },
        "approval_reference": "projects/bonds/slides/02-bond-anatomy.md#status-referencia-aprobada",
        "element_classification": [
          {
            "element_id": "bond-certificate",
            "render_mode": "code_native",
            "rationale": "El objeto, sus términos y sus estados de foco deben seguir siendo editables y participar en continuidad semántica."
          },
          {
            "element_id": "bond-terms",
            "render_mode": "code_native",
            "rationale": "Labels, cifras y relaciones contractuales no pueden quedar rasterizadas."
          },
          {
            "element_id": "cash-flow-timeline",
            "render_mode": "code_native",
            "rationale": "La timeline se revela y transforma por fases."
          }
        ]
      },
      {
        "unit_id": "slide-04",
        "semantic_spec": {
          "path": "projects/bonds/slides/04-discounting-example.md",
          "content_hash": "sha256:22e9e02c2d6c93cfa98a2842f5fecba4c7d705b346c27276299c89c598fc08f2"
        },
        "reference_id": "reference-04",
        "reference": {
          "path": "projects/bonds/references/04-discounting-example.webp",
          "content_hash": "sha256:068743fe4cd0d6b646e74af5b59229a25c98553501f166cd366d15563cfa551e"
        },
        "approval_reference": "projects/bonds/slides/04-discounting-example.md#status-referencia-aprobada",
        "element_classification": [
          {
            "element_id": "discount-timeline",
            "render_mode": "code_native",
            "rationale": "Cada flujo debe conservar identidad al conectarse con su término descontado."
          },
          {
            "element_id": "general-formula",
            "render_mode": "code_native",
            "rationale": "La notación debe permanecer accesible, editable y medible."
          },
          {
            "element_id": "expanded-formula",
            "render_mode": "code_native",
            "rationale": "Los cinco términos se construyen presenter-paced y requieren énfasis individual."
          }
        ]
      }
    ]
  },
  "reference_bindings": [
    {
      "reference_id": "reference-02",
      "scene_id": "slide-02",
      "baseline_hold_id": "s2-b3",
      "enhanced_hold_ids": ["s2-e1", "s2-e2", "s2-e3", "s2-e4", "s2-e5"],
      "essential_invariants": [
        "El certificado concreto sigue siendo el objeto que organiza la explicación.",
        "Emisor, cupón, precio, notional, valor nominal, vencimiento y frecuencia aparecen con significado correcto.",
        "El flujo del inversor conserva -100, 4, 4, 4, 4 y 104 euros."
      ],
      "mutable_properties": [
        "Número y posición de callouts simultáneos.",
        "Jerarquía secundaria, grouping y espaciado.",
        "Materialidad, color, profundidad y framing.",
        "Orden de aparición y composición móvil."
      ],
      "uncovered_parts": [
        "Estados intermedios enhanced.",
        "Composición mobile presenter y downsample."
      ]
    },
    {
      "reference_id": "reference-04",
      "scene_id": "slide-04",
      "baseline_hold_id": "s4-b4",
      "enhanced_hold_ids": ["s4-e1", "s4-e2", "s4-e3", "s4-e4", "s4-e5", "s4-e6"],
      "essential_invariants": [
        "Los cash flows son 4, 4, 4, 4 y 104 euros.",
        "El face value aparece únicamente en maturity.",
        "Cada CF_t se descuenta con su r_t y exponente t.",
        "La fórmula expandida conserva los cinco términos exactos."
      ],
      "mutable_properties": [
        "Distribución vertical entre timeline, regla y fórmula.",
        "Número de términos simultáneamente protagonistas.",
        "Framing, profundidad, color y correspondencia espacial.",
        "Composición móvil y orden de construcción."
      ],
      "uncovered_parts": [
        "Transformación visual de cada flujo en término descontado.",
        "Composición mobile presenter y downsample."
      ]
    }
  ],
  "enhancement_intent": {
    "summary": "Convertir dos buenas slides estáticas en explicaciones presenter-paced con protagonista único, craft premium, continuidad semántica y geometría robusta sin alterar su mensaje.",
    "dimensions": ["visual", "pedagogical", "immersive", "spatial"],
    "success_signals": [
      "El enhanced se distingue del baseline por jerarquía y materialidad, no por decoración.",
      "Cada hold resuelve una pregunta y limita la simultaneidad.",
      "Los objetos contractuales o matemáticos conservan identidad entre fases.",
      "Desktop, mobile presenter y downsample cumplen mínimos geométricos.",
      "Original, baseline y enhanced permiten una comparación inequívoca."
    ]
  },
  "transformative_delta": [
    {
      "delta_id": "S2-D01",
      "scene_id": "slide-02",
      "property": "Callout architecture",
      "baseline": "Siete callouts rodean simultáneamente el certificado.",
      "enhanced": "Tres capítulos semánticos —entrada, rendimiento y salida— sustituyen la corona de callouts y cada uno toma protagonismo en su hold.",
      "reason": "clarity",
      "expected_evidence": "Menos labels simultáneos y lectura inequívoca certificado → relación económica → timeline.",
      "essence_preserved": true
    },
    {
      "delta_id": "S2-D02",
      "scene_id": "slide-02",
      "property": "Pedagogical segmentation",
      "baseline": "La anatomía completa y la timeline conviven en el frame final.",
      "enhanced": "Cinco holds separan objeto, entrada, motor del cupón, maturity y traducción a cash flows.",
      "reason": "attention",
      "expected_evidence": "Un único protagonista por hold y máximo dos cambios materiales por beat.",
      "essence_preserved": true
    },
    {
      "delta_id": "S2-D03",
      "scene_id": "slide-02",
      "property": "Certificate craft",
      "baseline": "Certificado claro y plano con borde uniforme.",
      "enhanced": "Certificado editorial con textura CSS sutil, doble borde, profundidad contenida y spotlight finito.",
      "reason": "aesthetics",
      "expected_evidence": "El objeto se percibe más material y premium sin competir con los datos.",
      "essence_preserved": true
    },
    {
      "delta_id": "S2-D04",
      "scene_id": "slide-02",
      "property": "Responsive composition",
      "baseline": "El 16:9 desktop se reduce completo en móvil.",
      "enhanced": "Mobile usa certificado compacto, un capítulo activo y timeline simplificada; reparte el resto entre holds.",
      "reason": "spatial_robustness",
      "expected_evidence": "Cero clipping y texto material >= 9.5 px en 390x219 y >= 15 px en 390x844.",
      "essence_preserved": true
    },
    {
      "delta_id": "S4-D01",
      "scene_id": "slide-04",
      "property": "Formula reveal",
      "baseline": "Timeline, regla general y fórmula expandida terminan simultáneamente visibles.",
      "enhanced": "Seis holds construyen cash flows, distinguen maturity y conectan cada flujo con su término descontado.",
      "reason": "clarity",
      "expected_evidence": "El espectador puede atribuir cada numerador a un pago antes de ver la suma completa.",
      "essence_preserved": true
    },
    {
      "delta_id": "S4-D02",
      "scene_id": "slide-04",
      "property": "Timeline-to-formula correspondence",
      "baseline": "Timeline y ecuación se presentan en bandas separadas.",
      "enhanced": "Una columna de foco conecta el cash flow activo con el término homólogo mediante trayectoria y color persistente.",
      "reason": "immersion",
      "expected_evidence": "Continuidad visible entre objeto temporal y símbolo matemático sin duplicados persistentes.",
      "essence_preserved": true
    },
    {
      "delta_id": "S4-D03",
      "scene_id": "slide-04",
      "property": "Visual framing",
      "baseline": "Paneles rectangulares uniformes y fondo plano.",
      "enhanced": "Discount field con grid de tinta baja, superficies jerárquicas y glow localizado solo en el flujo protagonista.",
      "reason": "aesthetics",